{"buildHash":"sha256:00d9202f1e5b681617b18863753fff4b8b4a5a539af81f081ed791c892c96e0e","candidateId":"C0","captureProfileHash":"sha256:1d9ee0b874721a3eb1e45e1d347744f316bbd0f6b407184afcb37bb9abae18db","conflicts":[],"contractHash":"sha256:ba44573fabb3416f0e5b9cb4734607d115d97c0594817debc816e18d187323d1","contractStatus":"unambiguous","evidenceHashes":["sha256:f2eba5aa0a5703e0b57b4cb785ce523a2b0a18777ec91ad18698ce250e38b46c"],"evidenceStatus":"valid","imageInputRead":true,"perRequirement":[{"countable":true,"designRequirementId":"s0a.visual.req.ef7a4bf429119f82133d","frameNumbers":[240,300,360],"imageRegion":"central effect ROI and idle cleanup background","observation":"Visible flame fragments persist through stopping and remain in the idle frame at 300 in all three seed rows; later clearing by 360 does not satisfy the required clean idle checkpoint at 300.","reasonCode":"OBSERVED","state":"fail","stateRef":"stopping to idle cleanup"}],"qaGateAuthority":"advisory-only","reviewVersion":"s0a-visual-qa/1.0","s0aTerminalStatus":null,"sealedReportHash":"sha256:5d8c9b2ed68bdefd349151634469fbef14ed82232a061fd362e116cd6c2c77c4","topLevelRoute":"VISUAL_FAIL"}