{
  "reviewVersion": "s0a-visual-qa/1.0",
  "candidateId": "C0",
  "contractHash": "sha256:ba44573fabb3416f0e5b9cb4734607d115d97c0594817debc816e18d187323d1",
  "buildHash": "sha256:00d9202f1e5b681617b18863753fff4b8b4a5a539af81f081ed791c892c96e0e",
  "captureProfileHash": "sha256:1d9ee0b874721a3eb1e45e1d347744f316bbd0f6b407184afcb37bb9abae18db",
  "evidenceHashes": [
    "sha256:eafae2a7dea07c8194ef6eb5469b9d84e2820b544262c0338a9a3fbb0fe88923"
  ],
  "imageInputRead": true,
  "evidenceStatus": "valid",
  "contractStatus": "unambiguous",
  "s0aTerminalStatus": null,
  "qaGateAuthority": "advisory-only",
  "topLevelRoute": "VISUAL_PASS",
  "perRequirement": [
    {
      "designRequirementId": "s0a.visual.req.f25ef8b8809d5e580922",
      "state": "pass",
      "countable": true,
      "reasonCode": "OBSERVED",
      "stateRef": "starting, steady, stopping, and idle",
      "frameNumbers": [
        1,
        21,
        60,
        120,
        180,
        240,
        300,
        360
      ],
      "imageRegion": "full Beauty frame effect area across canonical, robustness-1, and robustness-2 seed rows",
      "observation": "Across all three seed rows, the sustained flame is visible through the required starting and steady frames, transitions through the stopping capture, and is fully absent in the idle frames 300 and 360; the complete lifecycle is observable and coherent."
    }
  ],
  "conflicts": [],
  "sealedReportHash": "sha256:291486f7d57de424a94ddac03c1650e63293355d7329eff70a9b019928dc9db6"
}
