{"buildHash":"sha256:00d9202f1e5b681617b18863753fff4b8b4a5a539af81f081ed791c892c96e0e","candidateId":"C0","captureProfileHash":"sha256:1d9ee0b874721a3eb1e45e1d347744f316bbd0f6b407184afcb37bb9abae18db","conflicts":[],"contractHash":"sha256:ba44573fabb3416f0e5b9cb4734607d115d97c0594817debc816e18d187323d1","contractStatus":"unambiguous","evidenceHashes":["sha256:1fa020fe490e53f93a4a204f9f8de96d770c8d12a7e11bd06d3dbb043d581b28"],"evidenceStatus":"valid","imageInputRead":true,"perRequirement":[{"countable":true,"designRequirementId":"s0a.visual.req.7ae72933515756bdfb56","frameNumbers":[21,60,120,180],"imageRegion":"full frame, comparing central and right-shifted flame ROIs","observation":"Across all three seed rows, the flame subject alternates between the central ground location and a distinctly right-shifted location on successive steady checkpoints (21/60/120/180), breaking spatial continuity of the sustained steady state.","reasonCode":"OBSERVED","state":"fail","stateRef":"steady"}],"qaGateAuthority":"advisory-only","reviewVersion":"s0a-visual-qa/1.0","s0aTerminalStatus":null,"sealedReportHash":"sha256:80ead948c5e1c6b0349057d167e2c300cdef652257874ddc8d60158ff04a0dc0","topLevelRoute":"VISUAL_FAIL"}