{
  "reviewVersion": "s0a-visual-qa/1.0",
  "candidateId": "C0",
  "contractHash": "sha256:ba44573fabb3416f0e5b9cb4734607d115d97c0594817debc816e18d187323d1",
  "buildHash": "sha256:00d9202f1e5b681617b18863753fff4b8b4a5a539af81f081ed791c892c96e0e",
  "captureProfileHash": "sha256:1d9ee0b874721a3eb1e45e1d347744f316bbd0f6b407184afcb37bb9abae18db",
  "evidenceHashes": [
    "sha256:a9f3f4d10a087f3dbcf31fd259c21222f3d761f0d80f89f097a6dc78668cac9b"
  ],
  "imageInputRead": true,
  "evidenceStatus": "valid",
  "contractStatus": "unambiguous",
  "s0aTerminalStatus": null,
  "qaGateAuthority": "advisory-only",
  "topLevelRoute": "VISUAL_PASS",
  "perRequirement": [
    {
      "designRequirementId": "s0a.visual.req.f4eb08883c8483afa62c",
      "state": "pass",
      "countable": true,
      "reasonCode": "OBSERVED",
      "stateRef": "start-steady-stop-cleanup",
      "frameNumbers": [
        1,
        21,
        60,
        120,
        180,
        240,
        300,
        360
      ],
      "imageRegion": "flame subject and ground-plane area in all three seed rows",
      "observation": "Across seeds 0, 1, and 2, the fixed slots collectively show flame onset, a visible sustained flame through frames 21, 60, 120, and 180, extinction in the stop/cleanup sequence, and a cleared final frame 360."
    }
  ],
  "sealedReportHash": "sha256:10bbb8d6d9bf1226b38857183d4b44963d55aebc254a9861c902557a7e7d7a1d"
}
