{
  "reviewVersion": "s0a-visual-qa/1.0",
  "candidateId": "C0",
  "contractHash": "sha256:ba44573fabb3416f0e5b9cb4734607d115d97c0594817debc816e18d187323d1",
  "buildHash": "sha256:00d9202f1e5b681617b18863753fff4b8b4a5a539af81f081ed791c892c96e0e",
  "captureProfileHash": "sha256:1d9ee0b874721a3eb1e45e1d347744f316bbd0f6b407184afcb37bb9abae18db",
  "evidenceHashes": [
    "sha256:f7f46c357f10fb82e6b277fb90839558334d0e2c4b3ee0dfedd8b96cfb8d557b"
  ],
  "imageInputRead": true,
  "evidenceStatus": "invalid",
  "contractStatus": "unambiguous",
  "s0aTerminalStatus": null,
  "qaGateAuthority": "advisory-only",
  "topLevelRoute": "EVIDENCE_INVALID",
  "perRequirement": [
    {
      "designRequirementId": "s0a.visual.req.86031236e5b950a84e32",
      "state": "uncertain",
      "countable": false,
      "reasonCode": "EVIDENCE_INVALID",
      "stateRef": "fixed-lifecycle-evidence-incomplete",
      "frameNumbers": [
        1
      ],
      "imageRegion": "Beauty slot seed 1, frame 1",
      "observation": "The fixed Beauty slot for seed 1, frame 1 is declared missing with no file and no actual hash, so the required 3x8 image set is incomplete."
    }
  ],
  "sealedReportHash": "sha256:82992980c6d708486872db0cbbe0c12f7cc0eba72c25685816d636a347e6060b"
}
