{"buildHash":"sha256:00d9202f1e5b681617b18863753fff4b8b4a5a539af81f081ed791c892c96e0e","candidateId":"C0","captureProfileHash":"sha256:1d9ee0b874721a3eb1e45e1d347744f316bbd0f6b407184afcb37bb9abae18db","conflicts":[],"contractHash":"sha256:ba44573fabb3416f0e5b9cb4734607d115d97c0594817debc816e18d187323d1","contractStatus":"unambiguous","evidenceHashes":["sha256:87147a5e3de7c4ee3fcc75f7c05e460d625f7e281167b73d8f179b01d50f982a"],"evidenceStatus":"valid","imageInputRead":true,"perRequirement":[{"countable":true,"designRequirementId":"s0a.visual.req.a3d1aec0c7cbaaa771a6","frameNumbers":[1,21,60,120,180,240,300,360],"imageRegion":"full Beauty frame; flame subject, ground-contact area, and cleanup background","observation":"The flame subject is visible across start and steady checkpoints and cleanup becomes empty, but its unusually large polygonal footprint and pronounced ground-plane shapes make it unreliable to distinguish a coherent sustained-flame lifecycle from a visible scale/grounding discontinuity at the fixed views.","reasonCode":"VISUAL_UNCERTAIN","state":"uncertain","stateRef":"starting, steady, stopping, and idle across seed rows 0-2"}],"qaGateAuthority":"advisory-only","reviewVersion":"s0a-visual-qa/1.0","s0aTerminalStatus":null,"sealedReportHash":"sha256:86751d06a109e1ae856fa52af0412a9ced73e6d12c001b14d6b650269a0e7cb2","topLevelRoute":"VISUAL_UNCERTAIN"}